{
  "schemaVersion": "0.1.0",
  "worldId": "world.12b62e85-ddc2-4b51-8bee-13caff97b372",
  "name": "Untitled World",
  "coordinateSystem": {
    "handedness": "right",
    "unit": "meter",
    "upAxis": "Y"
  },
  "assets": [
    {
      "id": "asset.model.001",
      "metadata": {
        "label": "p0-qa-building.glb"
      },
      "type": "model",
      "uri": "/assets/p0-qa-building.glb"
    }
  ],
  "entities": [
    {
      "components": {
        "core.renderable": {
          "assetId": "asset.model.001",
          "visible": true
        },
        "inha.location": {
          "areaId": "qa"
        },
        "world.building": {}
      },
      "enabled": true,
      "id": "entity.qa.building-001",
      "kind": "building",
      "metadata": {},
      "name": "Building 1",
      "parentId": null,
      "tags": [
        "inha-editor"
      ],
      "transform": {
        "position": [
          -2.86694594595,
          0,
          12.5
        ],
        "rotation": [
          0,
          0.258819045103,
          0,
          0.965925826289
        ],
        "scale": [
          1,
          1,
          1
        ]
      }
    },
    {
      "components": {
        "core.renderable": {
          "assetId": "asset.model.001",
          "visible": true
        },
        "inha.location": {
          "areaId": "qa"
        },
        "world.building": {}
      },
      "enabled": true,
      "id": "entity.qa.building-002",
      "kind": "building",
      "metadata": {},
      "name": "Building 2",
      "parentId": null,
      "tags": [
        "inha-editor"
      ],
      "transform": {
        "position": [
          12.384,
          0,
          13.321
        ],
        "rotation": [
          0,
          0,
          0,
          1
        ],
        "scale": [
          1.4,
          1,
          1
        ]
      }
    },
    {
      "components": {
        "world.path": {
          "closed": false,
          "pathType": "walkway",
          "points": [
            [
              0,
              0,
              0
            ],
            [
              10.315,
              0,
              -6.381
            ],
            [
              26.62,
              0,
              1.595
            ]
          ],
          "widthMeters": 2
        }
      },
      "enabled": true,
      "id": "entity.qa.path-001",
      "kind": "path",
      "metadata": {},
      "name": "Path 1",
      "parentId": null,
      "tags": [
        "inha-editor"
      ],
      "transform": {
        "position": [
          -22.204,
          0,
          -13.799
        ],
        "rotation": [
          0,
          0,
          0,
          1
        ],
        "scale": [
          1,
          1,
          1
        ]
      }
    },
    {
      "components": {
        "game.spawn": {
          "radiusMeters": 1,
          "refId": "player.p0-start",
          "spawnType": "player"
        }
      },
      "enabled": true,
      "id": "entity.qa.spawn-001",
      "kind": "spawn",
      "metadata": {},
      "name": "Spawn 1",
      "parentId": null,
      "tags": [
        "inha-editor"
      ],
      "transform": {
        "position": [
          -14.842,
          0,
          -1.037
        ],
        "rotation": [
          0,
          0,
          0,
          1
        ],
        "scale": [
          1,
          1,
          1
        ]
      }
    },
    {
      "components": {
        "game.spawn": {
          "radiusMeters": 1,
          "refId": "npc.p0-guide",
          "spawnType": "npc"
        }
      },
      "enabled": true,
      "id": "entity.qa.spawn-002",
      "kind": "spawn",
      "metadata": {},
      "name": "Spawn 2",
      "parentId": null,
      "tags": [
        "inha-editor"
      ],
      "transform": {
        "position": [
          12.592,
          0,
          -2.632
        ],
        "rotation": [
          0,
          0,
          0,
          1
        ],
        "scale": [
          1,
          1,
          1
        ]
      }
    },
    {
      "components": {
        "game.trigger": {
          "refId": "quest.p0-intro",
          "shape": {
            "size": [
              2,
              2,
              2
            ],
            "type": "box"
          },
          "triggerType": "quest"
        }
      },
      "enabled": true,
      "id": "entity.qa.trigger-001",
      "kind": "trigger",
      "metadata": {},
      "name": "Trigger 1",
      "parentId": null,
      "tags": [
        "inha-editor"
      ],
      "transform": {
        "position": [
          0.754,
          0,
          2.154
        ],
        "rotation": [
          0,
          0,
          0,
          1
        ],
        "scale": [
          1,
          1,
          1
        ]
      }
    }
  ],
  "metadata": {}
}
