{
  "schemaVersion": "0.1.0",
  "worldId": "aldol.studio.local",
  "name": "ALDOL Studio Session",
  "coordinateSystem": {
    "handedness": "right",
    "unit": "meter",
    "upAxis": "Y"
  },
  "assets": [],
  "entities": [
    {
      "components": {
        "world.structure": {
          "color": "#ffaa22",
          "shape": "box",
          "sizeMeters": [
            1,
            1,
            1
          ]
        }
      },
      "enabled": true,
      "id": "a-child",
      "kind": "prop",
      "metadata": {},
      "name": "P12 child",
      "parentId": "z-parent",
      "tags": [],
      "transform": {
        "position": [
          1,
          2,
          3
        ],
        "rotation": [
          0,
          0,
          0,
          1
        ],
        "scale": [
          0.5,
          0.75,
          1.25
        ]
      }
    },
    {
      "components": {
        "world.structure": {
          "color": "#ffaa22",
          "shape": "box",
          "sizeMeters": [
            1,
            1,
            1
          ]
        }
      },
      "enabled": false,
      "id": "disabled",
      "kind": "prop",
      "metadata": {},
      "name": "P12 disabled",
      "parentId": null,
      "tags": [],
      "transform": {
        "position": [
          0,
          1,
          0
        ],
        "rotation": [
          0,
          0,
          0,
          1
        ],
        "scale": [
          4,
          2,
          4
        ]
      }
    },
    {
      "components": {
        "world.structure": {
          "color": "#ffaa22",
          "shape": "box",
          "sizeMeters": [
            1,
            1,
            1
          ]
        }
      },
      "enabled": true,
      "id": "disabled-child",
      "kind": "prop",
      "metadata": {},
      "name": "P12 disabled child",
      "parentId": "disabled",
      "tags": [],
      "transform": {
        "position": [
          0,
          1,
          0
        ],
        "rotation": [
          0,
          0,
          0,
          1
        ],
        "scale": [
          4,
          2,
          4
        ]
      }
    },
    {
      "components": {
        "world.structure": {
          "color": "#ffaa22",
          "shape": "box",
          "sizeMeters": [
            1,
            1,
            1
          ]
        }
      },
      "enabled": true,
      "id": "visible",
      "kind": "prop",
      "metadata": {},
      "name": "P12 visible",
      "parentId": null,
      "tags": [],
      "transform": {
        "position": [
          0,
          1,
          0
        ],
        "rotation": [
          0,
          0,
          0,
          1
        ],
        "scale": [
          4,
          2,
          4
        ]
      }
    },
    {
      "components": {
        "user.keep": {
          "nested": [
            42,
            {
              "text": "preserve"
            }
          ]
        }
      },
      "enabled": true,
      "id": "z-parent",
      "kind": "prop",
      "metadata": {
        "provenance": "test-only"
      },
      "name": "P12 parent",
      "parentId": null,
      "tags": [],
      "transform": {
        "position": [
          4,
          2,
          6
        ],
        "rotation": [
          0,
          0.707106781187,
          0,
          0.707106781187
        ],
        "scale": [
          2,
          3,
          4
        ]
      }
    }
  ],
  "metadata": {}
}
